### ISSUE TITLE
Node is not syncing

### ISSUE THREAD

**Issue by mescedia** [input-output-hk/shelley-testnet#84]
**Describe the bug** 
 my node is not synching (according to https://github.com/input-output-hk/shelley-testnet/wiki/How-do-I-know-that-my-node-is-in-%60sync%60).  

**To Reproduce**
jcli and jormungandr binaries are from this package (v0.5.4): https://github.com/input-output-hk/jormungandr/releases/download/v0.5.4/jormungandr-v0.5.4-x86_64-unknown-linux-gnu.tar.gz

```
cardano@m26 $ echo $PATH
/usr/local/bin:/usr/bin:/bin:/usr/local/games:/usr/games:/usr/lib/jvm/java-8-openjdk-amd64:/home/cardano/jormungandr:/usr/lib/jvm/java-8-openjdk-amd64
```

```
cardano@m26 $ uname -a
Linux m26 4.9.0-9-amd64 #1 SMP Debian 4.9.168-1+deb9u5 (2019-08-11) x86_64 GNU/Linux
```

**config.yaml :**

```
log:
       format: "plain"
       level: "info"
       output: "stderr"

storage: "/tmp/jormungandr-storage-test/"

rest:
  listen: "127.0.0.1:8443"

p2p:
  listen_address: "/ip4/0.0.0.0/tcp/3100"
  trusted_peers: 
   - "/ip4/3.123.177.192/tcp/3000"
   - "/ip4/3.123.155.47/tcp/3000"
   - "/ip4/52.57.157.167/tcp/3000"
   - "/ip4/3.112.185.217/tcp/3000"
   - "/ip4/18.140.134.230/tcp/3000"
   - "/ip4/18.139.40.4/tcp/3000"
   - "/ip4/3.115.57.216/tcp/3000"
  public_address: 
  topics_of_interest:
    messages: high
    blocks: high
```

I am running jormungandr from a small shell script (run.testnet): 
```
#!/bin/bash
jormungandr \
   --genesis-block-hash adbdd5ede31637f6c9bad5c271eec0bc3d0cb9efb86a5b913bb55cba549d0770 \
   --config config.yaml  \
   --log-level=info 
```

   
```
cardano@m26 ~/jormungandr $ ./run.testnet
Oct 01 08:25:10.189 INFO Starting jormungandr 0.5.4 (HEAD-a9ec5ce, release, linux [x86_64]) - [rustc 1.38.0 (625451e37 2019-09-23)], task: init
Oct 01 08:25:10.191 WARN Node started without path to the stored secret keys (not a stake pool or a BFT leader), task: init
Oct 01 08:25:10.192 INFO storing blockchain in '"/tmp/jormungandr-storage-test/blocks.sqlite"', task: init
Oct 01 08:25:34.841 INFO connecting to bootstrap peer 3.123.155.47:3000, peer_addr: 3.123.155.47:3000, task: bootstrap
Oct 01 08:25:34.903 WARN with initial bootstrap, reason: bootstrap pull request failed, peer_addr: 3.123.155.47:3000, task: bootstrap
Oct 01 08:25:34.903 INFO connecting to bootstrap peer 18.140.134.230:3000, peer_addr: 18.140.134.230:3000, task: bootstrap
Oct 01 08:25:35.484 WARN with initial bootstrap, reason: bootstrap pull request failed, peer_addr: 18.140.134.230:3000, task: bootstrap
Oct 01 08:25:35.484 INFO connecting to bootstrap peer 18.139.40.4:3000, peer_addr: 18.139.40.4:3000, task: bootstrap
Oct 01 08:25:36.059 WARN with initial bootstrap, reason: bootstrap pull request failed, peer_addr: 18.139.40.4:3000, task: bootstrap
Oct 01 08:25:36.059 INFO connecting to bootstrap peer 52.57.157.167:3000, peer_addr: 52.57.157.167:3000, task: bootstrap
Oct 01 08:25:36.274 INFO initial bootstrap completed, peer_addr: 52.57.157.167:3000, task: bootstrap
Oct 01 08:25:36.275 INFO starting task, task: client-query
Oct 01 08:25:36.275 INFO starting task, task: network
Oct 01 08:25:36.275 INFO adding P2P Topology module: trusted-peers, task: network
Oct 01 08:25:36.275 INFO Starting 1 workers, scope: global
Oct 01 08:25:36.275 INFO start listening and accepting gRPC connections on 0.0.0.0:3100, task: network
Oct 01 08:25:36.276 INFO Starting server on 127.0.0.1:8443, scope: global
Oct 01 08:25:36.277 INFO connecting to initial gossip peer, peer_addr: 3.112.185.217:3000, task: network
Oct 01 08:25:36.277 INFO connecting to initial gossip peer, peer_addr: 3.115.57.216:3000, task: network
Oct 01 08:25:36.277 INFO connecting to initial gossip peer, peer_addr: 52.57.157.167:3000, task: network
Oct 01 08:25:36.277 INFO connecting to initial gossip peer, peer_addr: 18.139.40.4:3000, task: network
Oct 01 08:25:36.278 INFO connecting to initial gossip peer, peer_addr: 3.123.177.192:3000, task: network
Oct 01 08:25:36.278 INFO connecting to initial gossip peer, peer_addr: 3.123.155.47:3000, task: network
Oct 01 08:25:36.278 INFO connecting to initial gossip peer, peer_addr: 18.140.134.230:3000, task: network
```

no further blocks are downloaded (**blockRecvCnt: 0**)  after startup ...
    
```
cardano@m26 ~/jormungandr $ jcli rest v0 node stats get -h http://127.0.0.1:8443/api
blockRecvCnt: 0
lastBlockDate: "220.40561"
lastBlockFees: 0
lastBlockHash: 147f34dd1cfb41a3494c669ad04158b230d5e5ef26c4b00e79dc4c2f1051caf7
lastBlockHeight: "35258"
lastBlockSum: 0
lastBlockTime: ~
lastBlockTx: 0
txRecvCnt: 0
uptime: 2261
```

**Expected behavior**
Block-receive-counter (blockRecvCnt: 0)  must increment if blocks are received  (according to [wiki::How-do-I-know-that-my-node-is-in-sync ](https://github.com/input-output-hk/shelley-testnet/wiki/How-do-I-know-that-my-node-is-in-%60sync%60) )

**Additional context**

... there is some (low) traffic on tcp port 3000 but no blocks are downloaded:

```
root@m26 #  tcpdump -n tcp port 3000
tcpdump: verbose output suppressed, use -v or -vv for full protocol decode
listening on eth0, link-type EN10MB (Ethernet), capture size 262144 bytes
09:11:11.020008 IP 95.217.XXY.YYY.52222 > 3.112.185.217.3000: Flags [P.], seq 3312956649:3312956663, ack 2105479848, win 229, options [nop,nop,TS val 636203851 ecr 1384280707], length 14
09:11:11.020039 IP 95.217.XXY.YYY.35538 > 3.123.177.192.3000: Flags [P.], seq 1143493513:1143493527, ack 1751832535, win 229, options [nop,nop,TS val 636203851 ecr 4122849390], length 14
09:11:11.020042 IP 95.217.XXY.YYY.43370 > 3.123.155.47.3000: Flags [P.], seq 4098653900:4098653914, ack 2883720639, win 229, options [nop,nop,TS val 636203851 ecr 2939132460], length 14
09:11:11.020044 IP 95.217.XXY.YYY.34878 > 18.140.134.230.3000: Flags [P.], seq 1737126526:1737126540, ack 2385047228, win 229, options [nop,nop,TS val 636203851 ecr 501216192], length 14
09:11:11.020077 IP 95.217.XXY.YYY.40248 > 3.115.57.216.3000: Flags [P.], seq 2270118255:2270118269, ack 2925070855, win 229, options [nop,nop,TS val 636203851 ecr 889665052], length 14
09:11:11.020084 IP 95.217.XXY.YYY.53902 > 18.139.40.4.3000: Flags [P.], seq 290513828:290513842, ack 3827300861, win 229, options [nop,nop,TS val 636203851 ecr 28291791], length 14
09:11:11.020113 IP 95.217.XXY.YYY.45334 > 52.57.157.167.3000: Flags [P.], seq 2357761973:2357761987, ack 2472180758, win 229, options [nop,nop,TS val 636203851 ecr 218241674], length 14
09:11:11.045796 IP 3.123.177.192.3000 > 95.217.XXY.YYY.35538: Flags [.], ack 14, win 210, options [nop,nop,TS val 4122859391 ecr 636203851], length 0
09:11:11.046085 IP 52.57.157.167.3000 > 95.217.XXY.YYY.45334: Flags [.], ack 14, win 210, options [nop,nop,TS val 218251674 ecr 636203851], length 0
09:11:11.046610 IP 3.123.155.47.3000 > 95.217.XXY.YYY.43370: Flags [.], ack 14, win 210, options [nop,nop,TS val 2939142461 ecr 636203851], length 0
09:11:11.271267 IP 3.115.57.216.3000 > 95.217.XXY.YYY.40248: Flags [.], ack 14, win 210, options [nop,nop,TS val 889675053 ecr 636203851], length 0
09:11:11.282074 IP 3.112.185.217.3000 > 95.217.XXY.YYY.52222: Flags [.], ack 14, win 210, options [nop,nop,TS val 1384290707 ecr 636203851], length 0
09:11:11.292064 IP 18.140.134.230.3000 > 95.217.XXY.YYY.34878: Flags [.], ack 14, win 210, options [nop,nop,TS val 501226193 ecr 636203851], length 0
09:11:11.310042 IP 18.139.40.4.3000 > 95.217.XXY.YYY.53902: Flags [.], ack 14, win 210, options [nop,nop,TS val 28301792 ecr 636203851], length 0

09:11:21.019728 IP 95.217.XXY.YYY.40248 > 3.115.57.216.3000: Flags [P.], seq 14:28, ack 1, win 229, options [nop,nop,TS val 636206351 ecr 889675053], length 14
09:11:21.019755 IP 95.217.XXY.YYY.52222 > 3.112.185.217.3000: Flags [P.], seq 14:28, ack 1, win 229, options [nop,nop,TS val 636206351 ecr 1384290707], length 14
09:11:21.019780 IP 95.217.XXY.YYY.45334 > 52.57.157.167.3000: Flags [P.], seq 14:28, ack 1, win 229, options [nop,nop,TS val 636206351 ecr 218251674], length 14
09:11:21.019792 IP 95.217.XXY.YYY.35538 > 3.123.177.192.3000: Flags [P.], seq 14:28, ack 1, win 229, options [nop,nop,TS val 636206351 ecr 4122859391], length 14
09:11:21.019803 IP 95.217.XXY.YYY.53902 > 18.139.40.4.3000: Flags [P.], seq 14:28, ack 1, win 229, options [nop,nop,TS val 636206351 ecr 28301792], length 14
09:11:21.019849 IP 95.217.XXY.YYY.34878 > 18.140.134.230.3000: Flags [P.], seq 14:28, ack 1, win 229, options [nop,nop,TS val 636206351 ecr 501226193], length 14
09:11:21.019884 IP 95.217.XXY.YYY.43370 > 3.123.155.47.3000: Flags [P.], seq 14:28, ack 1, win 229, options [nop,nop,TS val 636206351 ecr 2939142461], length 14
09:11:21.045563 IP 3.123.177.192.3000 > 95.217.XXY.YYY.35538: Flags [.], ack 28, win 210, options [nop,nop,TS val 4122869391 ecr 636206351], length 0
09:11:21.045759 IP 52.57.157.167.3000 > 95.217.XXY.YYY.45334: Flags [.], ack 28, win 210, options [nop,nop,TS val 218261674 ecr 636206351], length 0
09:11:21.046420 IP 3.123.155.47.3000 > 95.217.XXY.YYY.43370: Flags [.], ack 28, win 210, options [nop,nop,TS val 2939152461 ecr 636206351], length 0
09:11:21.270859 IP 3.115.57.216.3000 > 95.217.XXY.YYY.40248: Flags [.], ack 28, win 210, options [nop,nop,TS val 889685052 ecr 636206351], length 0
09:11:21.281719 IP 3.112.185.217.3000 > 95.217.XXY.YYY.52222: Flags [.], ack 28, win 210, options [nop,nop,TS val 1384300707 ecr 636206351], length 0
09:11:21.291825 IP 18.140.134.230.3000 > 95.217.XXY.YYY.34878: Flags [.], ack 28, win 210, options [nop,nop,TS val 501236193 ecr 636206351], length 0
09:11:21.309682 IP 18.139.40.4.3000 > 95.217.XXY.YYY.53902: Flags [.], ack 28, win 210, options [nop,nop,TS val 28311792 ecr 636206351], length 0
```

**Comment by mescedia** [comment]
.. looks like it was alread solved here: https://github.com/input-output-hk/jormungandr/issues/860
